{
  "$schema": "http://json-schema.org/draft-07/schema#",
  "$id": "https://5stack.gg/schemas/registry-plugin.json",
  "title": "5Stack Plugin Registry Entry",
  "type": "object",
  "required": [
    "slug",
    "kind",
    "name",
    "author",
    "description"
  ],
  "additionalProperties": false,
  "properties": {
    "$schema": {
      "type": "string"
    },
    "slug": {
      "type": "string",
      "pattern": "^[a-z0-9]+(?:-[a-z0-9]+)*$",
      "description": "Unique id. Also the directory name in a node's plugin store."
    },
    "kind": {
      "enum": [
        "game",
        "panel",
        "bundle"
      ],
      "description": "game = CS2 server plugin, panel = Module Federation page, bundle = both."
    },
    "name": {
      "type": "string"
    },
    "author": {
      "type": "string"
    },
    "description": {
      "type": "string"
    },
    "homepage": {
      "type": "string",
      "format": "uri"
    },
    "tags": {
      "type": "array",
      "items": {
        "type": "string"
      }
    },
    "verified": {
      "type": "boolean",
      "default": false,
      "description": "Reviewed by a 5Stack maintainer. Set in review, never by the submitter."
    },
    "hot_swappable": {
      "type": "boolean",
      "default": false,
      "description": "Safe to load/unload live over RCON without restarting the server."
    },
    "requires_service": {
      "type": [
        "string",
        "null"
      ],
      "description": "External dependency an operator must provide, e.g. \"MySQL\"."
    },
    "requires_server_guidelines_disabled": {
      "type": "boolean",
      "default": false,
      "description": "Needs FollowCS2ServerGuidelines set to false to work at all. The panel hides the plugin's functionality behind a per-install opt-in and warns that Valve can ban every GSLT on the operator's account."
    },
    "variants": {
      "type": "object",
      "description": "Per-runtime source of the game plugin. Required when kind is game or bundle.",
      "additionalProperties": false,
      "minProperties": 1,
      "properties": {
        "swiftlys2": {
          "$ref": "#/definitions/variant"
        },
        "counterstrikesharp": {
          "$ref": "#/definitions/variant"
        }
      }
    },
    "config_schema": {
      "type": "object",
      "description": "JSON Schema for the plugin's config file. The panel renders a form from it; without one the file is edited as JSON."
    },
    "config_path": {
      "type": "string",
      "description": "Where the config file is written, relative to game/csgo. {runtime} is substituted."
    },
    "config_cvar": {
      "type": "string",
      "description": "Console variable the plugin reads the config file's path from. The panel sets it to config_path on every server it writes the file to."
    },
    "config_shipped": {
      "type": "object",
      "description": "Where the plugin keeps its own copy of the config file, so the panel can link to it.",
      "additionalProperties": false,
      "properties": {
        "path": {
          "type": "string",
          "description": "Where the release installs it, relative to game/csgo. {runtime} is substituted."
        },
        "repo_path": {
          "type": "string",
          "description": "Where it lives in the source repository, linked at the installed release's tag."
        }
      }
    },
    "config_default": {
      "type": [
        "object",
        "array"
      ],
      "description": "The config file the plugin ships with. The panel starts the editor from it."
    },
    "cvars": {
      "type": "array",
      "items": {
        "type": "string"
      },
      "description": "Console variables this plugin reads. A server running the plugin reports each one's description, type and default to the panel, which renders the settings form from them."
    },
    "forced_cvars": {
      "type": "array",
      "items": {
        "type": "string"
      },
      "description": "Console variables the plugin sets itself on every map load, after the server's configs have run. The panel warns when a config sets one, because the plugin overwrites it."
    },
    "map_rotation": {
      "type": "object",
      "description": "Declares this plugin runs a dedicated server's map rotation. The panel renders each file from the server's rotation and writes it before the server boots.",
      "required": [
        "files",
        "map"
      ],
      "additionalProperties": false,
      "properties": {
        "files": {
          "type": "object",
          "minProperties": 1,
          "description": "Path relative to game/csgo ({runtime} is substituted) mapped to the JSON document written there. A string that is exactly {{maps}} becomes the rendered map list, exactly {{shuffle}} becomes a boolean.",
          "additionalProperties": {
            "type": "object"
          }
        },
        "map": {
          "type": "object",
          "description": "One rotation entry. {{id}} is the workshop id or the map name, {{name}} the map name, {{label}} the display name, {{workshop_id}} the workshop id or null."
        }
      }
    },
    "panel": {
      "type": "object",
      "description": "Panel plugin coordinates. Required when kind is panel or bundle.",
      "required": [
        "slug",
        "manifest_url"
      ],
      "additionalProperties": false,
      "properties": {
        "manifest_url": {
          "type": "string",
          "format": "uri"
        },
        "repo": {
          "type": "string"
        },
        "install_command": {
          "type": "string"
        },
        "slug": {
          "type": "string",
          "pattern": "^[a-z0-9]+(?:-[a-z0-9]+)*$",
          "description": "The slug from the plugin's own 5stack-plugin.json \u2014 the /apps/<slug> route it claims. The panel uses it to tell whether this is already installed."
        }
      }
    },
    "wiring": {
      "type": "object",
      "description": "How a panel plugin configures the game plugin it pairs with.",
      "required": [
        "provision",
        "config",
        "target"
      ],
      "additionalProperties": false,
      "properties": {
        "provision": {
          "type": "object",
          "required": [
            "from",
            "endpoint",
            "method"
          ],
          "additionalProperties": false,
          "properties": {
            "from": {
              "enum": [
                "panel"
              ]
            },
            "endpoint": {
              "type": "string"
            },
            "method": {
              "enum": [
                "GET",
                "POST"
              ]
            },
            "response_key": {
              "type": "string"
            }
          }
        },
        "config": {
          "type": "object",
          "additionalProperties": {
            "type": "string"
          },
          "description": "Templated values. {panel.base_url} and {provision.<key>} are substituted."
        },
        "target": {
          "enum": [
            "mode_cfg",
            "plugin_config"
          ],
          "description": "mode_cfg writes cvars into the game mode's cfg block."
        }
      }
    },
    "versions": {
      "type": "array",
      "description": "Injected by registry CI from upstream releases. Never hand-written.",
      "items": {
        "type": "object",
        "required": [
          "version",
          "runtime",
          "url",
          "sha256",
          "published_at"
        ],
        "properties": {
          "version": {
            "type": "string"
          },
          "runtime": {
            "enum": [
              "swiftlys2",
              "counterstrikesharp"
            ]
          },
          "url": {
            "type": "string",
            "format": "uri"
          },
          "sha256": {
            "type": "string",
            "pattern": "^[a-f0-9]{64}$"
          },
          "size": {
            "type": "integer"
          },
          "published_at": {
            "type": "string",
            "format": "date-time"
          },
          "prerelease": {
            "type": "boolean"
          }
        }
      }
    },
    "pairs_with": {
      "type": "array",
      "items": {
        "type": "string"
      },
      "description": "Slugs of other entries this works with. A panel plugin that configures a game plugin names it here rather than republishing its releases."
    }
  },
  "definitions": {
    "variant": {
      "type": "object",
      "required": [
        "repo",
        "asset"
      ],
      "additionalProperties": false,
      "properties": {
        "repo": {
          "type": "string",
          "pattern": "^[^/]+/[^/]+$"
        },
        "asset": {
          "type": "string",
          "description": "Glob matched against release asset names, e.g. \"InventorySimulator-v*.zip\". Game servers are Linux only: assets naming another platform are never selected, and a glob that names one is rejected."
        },
        "layout": {
          "enum": [
            "csgo",
            "plugin"
          ],
          "default": "csgo",
          "description": "csgo = archive root is game/csgo. plugin = archive root is the plugin folder, extracted under install_path."
        },
        "install_path": {
          "type": "string",
          "description": "Required when layout is plugin. Relative to game/csgo; {runtime} is substituted."
        },
        "include_prereleases": {
          "type": "boolean",
          "default": false
        }
      }
    }
  }
}
