{
  "$schema": "../../schema/plugin.schema.json",
  "slug": "retakes",
  "kind": "game",
  "name": "Retakes",
  "author": "aga",
  "description": "Bombsite retakes with auto-plant, instant defuse, per-map spawns and smoke scenarios, round-type weapon and utility allocation, queueing and an in-game spawn editor. Loadout preferences persist when the Cookies plugin is installed.",
  "homepage": "https://github.com/a2Labs-cc/SwiftlyS2-Retakes",
  "tags": ["gamemode", "retakes", "practice"],
  "verified": true,
  "hot_swappable": false,
  "variants": {
    "swiftlys2": {
      "repo": "a2Labs-cc/SwiftlyS2-Retakes",
      "asset": "Retakes-v*.zip",
      "layout": "plugin",
      "install_path": "addons/swiftlys2/plugins"
    }
  }
}
